text,label
ರಲ್ಲಿ ರಾಜಕೀಯ ನಾಯಕನ ಆಸ್ತಿ ಬಗ್ಗೆ ಸುಳ್ಳು ಸುದ್ದಿ,0
ವೈದ್ಯಕೀಯ ಸಂಶೋಧನೆಯ ಫಲಿತಾಂಶವನ್ನು ತಪ್ಪಾಗಿ ವಿವರಿಸಿದ ಸುದ್ದಿ,0
ರಲ್ಲಿ ಆರ್ಥಿಕ ಮಾರುಕಟ್ಟೆಯಲ್ಲಿ ಬಂಡವಾಳ ಹೂಡಿಕೆ ಬಗ್ಗೆ ತಪ್ಪು ವರದಿ,0
Paytmನಲ್ಲಿ ಹಣವೆಷ್ಟು ಸೇಫ್ ಇಲ್ಲಿದೆ ಬಹುದೊಡ್ಡ ಪ್ರಶ್ನೆ,1
ರಲ್ಲಿ ಪ್ರಸಿದ್ಧ ಗಾಯಕನ ಹೊಸ ಆಲ್ಬಮ್ ಬಗ್ಗೆ ಸುಳ್ಳು ಸುದ್ದಿ,0
ಸಪ್ತಪದಿ ತುಳಿದ ಭಾರತೀಯ ಹಾಕಿ ಆಟಗಾರ ಎಸ್​ ವಿ ಸುನಿಲ್​ ಇಂದು ಮಡಿಕೇರಿಯಲ್ಲಿ ಆರತಕ್ಷತೆ,1
video ಸ್ವಿಟ್ಜರ್​ಲೆಂಡ್​ನಲ್ಲಿ ಮಕ್ಕಳೊಂದಿಗೆ ರಜೆಯ ಮಜ ಸವಿದ ಹೃತಿಕ್​ ರೋಷನ್​,1
ರಲ್ಲಿ ಪ್ರಸಿದ್ಧ ಆಟಗಾರನ ನಿವೃತ್ತಿ ಬಗ್ಗೆ ಸುಳ್ಳು ಸುದ್ದಿ,0
ಪ್ರಸಿದ್ಧ ವ್ಯಕ್ತಿಯ ಬಂಧನದ ಬಗ್ಗೆ ಸುಳ್ಳು ವರದಿ,0
ರಲ್ಲಿ ರಾಜಕೀಯ ನಾಯಕನ ರಾಜೀನಾಮೆ ಬಗ್ಗೆ ಸುಳ್ಳು ಮಾಹಿತಿ,0
ಆರ್ಥಿಕ ಹೂಡಿಕೆ ಬಗ್ಗೆ ಸುಳ್ಳು ಮಾಹಿತಿ,0
ರಲ್ಲಿ ರಾಜಕೀಯ ಪಕ್ಷದ ಸದಸ್ಯರ ರಾಜೀನಾಮೆ ಬಗ್ಗೆ ತಪ್ಪು ವರದಿ,0
ವೈರಲ್ ಆಗುತ್ತಿದೆ ಇಂಗ್ಲೆಂಡ್​ನಲ್ಲಿರುವ ವಿರುಷ್ಕಾ ಫೋಟೋ ಅಂಥದ್ದೇನಿದೆ ಗೊತ್ತಾ,1
ರಲ್ಲಿ ರಾಜಕೀಯ ನಾಯಕನ ಹೊಸ ಯೋಜನೆ ಯಶಸ್ವಿಯಾಗಿದೆ ತಪ್ಪು ಸುದ್ದಿ,0
ಬಿ ಟೌಟ್​ನಲ್ಲಿ ವಿಲನ್ ಪಾತ್ರಗಳಿಂದ ಬಾಕ್ಸಾಫಿಸ್​ನಲ್ಲಿ ಭಾರಿ ಸದ್ದು ಮಾಡಿದ ಸಿನಿಮಾಗಳು,1
ಅತಿಥಿ ಚಿತ್ರನಟಿ ಅಮೂಲ್ಯ ಅವರೊಂದಿಗಿನ ವಿಶೇಷ ಮಾತುಕತೆ ಭಾಗ,1
ಆರ್ಥಿಕ ಮಾರುಕಟ್ಟೆಯಲ್ಲಿ ಹೊಸ ಹೂಡಿಕೆ ಬಗ್ಗೆ ತಪ್ಪು ವರದಿ,0
ರಲ್ಲಿ ರಾಜಕೀಯ ಪಕ್ಷದ ಗೆಲುವಿನ ಬಗ್ಗೆ ಸುಳ್ಳು ವರದಿ,0
ರಲ್ಲಿ ಆರ್ಥಿಕ ಮಾರುಕಟ್ಟೆಯಲ್ಲಿ ಹೂಡಿಕೆದಾರರ ಬಗ್ಗೆ ತಪ್ಪು ಮಾಹಿತಿ,0
ಕನ್ನಡ ಬಿಗ್ ​ಬಾಸ್ ಮನೆಗೆ ಮೂವರು ಬಂದರು ಒಬ್ಬರು ಹೋದರು,1
ರಲ್ಲಿ ಹೊಸ ಟೆಕ್ ಉತ್ಪನ್ನದಲ್ಲಿ ಅಪಾಯವಿದೆ ಸುಳ್ಳು ಸುದ್ದಿ,0
ರಲ್ಲಿ ವೈದ್ಯಕೀಯ ಉತ್ಪನ್ನದ ಲಾಭದ ಬಗ್ಗೆ ತಪ್ಪು ವರದಿ,0
ರಲ್ಲಿ ಪ್ರಸಿದ್ಧ ಗಾಯಕನ ಹೊಸ ಸಂಗೀತ ಕಾರ್ಯಕ್ರಮದ ಬಗ್ಗೆ ಸುಳ್ಳು ಸುದ್ದಿ,0
ದಿ ವಿಲನ್​ ಟೀಸರ್​ ನೋಡಿ ರಾಮ್​ಗೋಪಾಲ್​ ವರ್ಮಾ ಅಂದಿದ್ದೇನು ಗೊತ್ತಾ,1
ರಲ್ಲಿ ಆರ್ಥಿಕ ಮಾರುಕಟ್ಟೆಯಲ್ಲಿ ಹೂಡಿಕೆದಾರರ ಬಗ್ಗೆ ಸುಳ್ಳು ಸುದ್ದಿ,0
ರಲ್ಲಿ ರಾಜಕೀಯ ನಾಯಕನ ರಾಜೀನಾಮೆ ಬಗ್ಗೆ ತಪ್ಪು ಮಾಹಿತಿ,0
ವಾಂಟೆಡ್ ಸಿನಿಮಾದಿಂದ ಸಲ್ಲು ಔಟ್​ ಟೈಗರ್​ ಇನ್​,1
ಏಷ್ಯನ್ ಗೇಮ್ಸ್ ಕಬಡ್ಡಿ ಸೆಮಿಫೈನಲ್​​ನಲ್ಲಿ ಭಾರತಕ್ಕೆ ಸೋಲು ಇತಿಹಾಸ ನಿರ್ಮಿಸಿದ ಇರಾನ್,1
metoo ಆಯ್ತು weoppose ಹೊಸ ಅಭಿಯಾನಕ್ಕೆ ನಾಂದಿ ಹಾಡಿದ ನಂದಿತಾ ಶ್ವೇತಾ,1
ರಲ್ಲಿ ಪ್ರಸಿದ್ಧ ಗಾಯಕನ ಹೊಸ ಸಂಗೀತ ಕಾರ್ಯಕ್ರಮದ ಬಗ್ಗೆ ಸುಳ್ಳು ಸುದ್ದಿ,0
ಬಾಕ್ಸಿಂಗ್ ಬ್ರಿಡ್ಜ್​ನಲ್ಲೂ ಸ್ವರ್ಣಬೇಟೆ ಭಾರತಕ್ಕೆ ಚಿನ್ನಗಳ ಗರಿ,1
ಮೀನು ಮಾರುಕಟ್ಟೆಯಲ್ಲಿ ಸರಾಗವಾಗಿ ಓಡಾಡುತ್ತಿದ್ದ ರಕ್ಷಿತ್​ ಶೆಟ್ಟಿಗೆ ಬೌನ್ಸರ್​ಗಳ ಕಾವಲು,1
ವೈದ್ಯಕೀಯ ಉತ್ಪನ್ನದ ಪರಿಣಾಮಗಳ ಬಗ್ಗೆ ತಪ್ಪು ಸುದ್ದಿ,0
ರಲ್ಲಿ ರಾಜಕೀಯ ಪಕ್ಷದ ಸದಸ್ಯರ ರಾಜೀನಾಮೆ ಬಗ್ಗೆ ಸುಳ್ಳು ವರದಿ,0
ಬೆಂಗಳೂರಿನಲ್ಲಿ ದೇಶದ ಮೊದಲ ತ್ಯಾಜ್ಯ ಮರುಸಂಸ್ಕರಣಾ ಘಟಕ,1
ಆರ್ಥಿಕ ಹೂಡಿಕೆ ಬಗ್ಗೆ ಸುಳ್ಳು ಮಾಹಿತಿ,0
ವೈರಲ್ ವಿಡಿಯೋದಲ್ಲಿ ತೋರಿದ ಘಟನೆ ನಿಜವಲ್ಲ,0
ರಲ್ಲಿ ರಾಜಕೀಯ ನಾಯಕನ ಬಂಧನದ ಬಗ್ಗೆ ತಪ್ಪು ಸುದ್ದಿ,0
ಬಾರ್ಸಿಲೋನಾ ಸಿನಿಮಾ ಉತ್ಸವದಲ್ಲಿ ಬೆಳಗಾವಿ ಕನ್ನಡ ಶಿಕ್ಷಕನ ಚಿತ್ರ,1
ಬಾಲಿವುಡ್‍ನಲ್ಲಿ ಟೈಗರ್ ಘರ್ಜನೆ ಶುರು ನಾಲ್ಕು ದಿನಕ್ಕೇ ಭಾಗಿ ಕಲೆಕ್ಷನ್ ಎಷ್ಟು ಗೊತ್ತಾ,1
ಪಿಬಿಎಲ್ ಕಿರೀಟ ತೊಟ್ಟ ಬೆಂಗಳೂರು ರ‍್ಯಾಪ್ಟರ್ಸ್,1
ಇಂತಿ ದೀಪು ಪ್ರೀತಿಯ ಅಂಬಿ ಮಾಮನಿಗೆ ಕಿಚ್ಚ ಸುದೀಪ್​ ಅಕ್ಷರ ನಮನ,1
ರಲ್ಲಿ ಪ್ರಸಿದ್ಧ ಗಾಯಕನ ಹೊಸ ಆಲ್ಬಮ್ ಬಗ್ಗೆ ಸುಳ್ಳು ಸುದ್ದಿ,0
ನೆಟ್​ಫ್ಲಿಕ್ಸ್​ಗೆ ಸ್ಪರ್ಧೆ ನೀಡಲು ಬರುತ್ತಿದೆ ಯೂಟ್ಯೂಬ್​ ರೆಡ್​,1
ವೈದ್ಯಕೀಯ ಉತ್ಪನ್ನದ ಅಪಾಯಗಳ ಬಗ್ಗೆ ತಪ್ಪು ಮಾಹಿತಿ,0
photos ಶುಕ್ರವಾರ ದರ್ಶನ ನೀಡಲಿದ್ದಾನೆ ಲಂಬೋದರ,1
ದೇವದಾಸು ಸಿನಿಮಾದ ನಂತರ ನಾಪತ್ತೆಯಾಗಿದ್ದ ರಶ್ಮಿಕಾ ಮಾಡುತ್ತಿದ್ದಾರೆ ಗೊತ್ತಾ,1
ಇಂಡೋನೇಷ್ಯಾ ಓಪನ್ ಕ್ವಾರ್ಟರ್ ಫೈನಲ್​​ನಲ್ಲಿ ಸಿಂಧು ಪ್ರಣಾಯ್​ಗೆ ಸೋಲು ಟೂರ್ನಿಯಿಂದ ಹೊರಬಿದ್ದ ಭಾರತ,1
ವಾಟ್ಸಪ್​ ಬದಲು ಆ್ಯಪ್​ಗಳನ್ನು ಬಳಸಿ,1
ರಲ್ಲಿ ಆರ್ಥಿಕ ಮಾರುಕಟ್ಟೆಯಲ್ಲಿ ಹೊಸ ಹೂಡಿಕೆ ಬಗ್ಗೆ ತಪ್ಪು ವರದಿ,0
ಟಿವಿಎಸ್ ಅಪಾಚೆ ಆರ್​ಆರ್ ಬೈಕ್ ಬೆಲೆಯಲ್ಲಿ ಸಾವಿರ ರೂ ಹೆಚ್ಚಳ,1
ರಲ್ಲಿ ಆರೋಗ್ಯ ಉತ್ಪನ್ನದ ಅಪಾಯಗಳ ಬಗ್ಗೆ ತಪ್ಪು ವರದಿ,0
ರಲ್ಲಿ ಪ್ರಸಿದ್ಧ ಗಾಯಕನ ಹೊಸ ಆಲ್ಬಮ್ ಬಗ್ಗೆ ತಪ್ಪು ವರದಿ,0
ಹೈದರಾಬಾದ್​ ವಿರುದ್ಧ ಆರ್​ಸಿಬಿಗೆ ಅಗ್ನಿಪರೀಕ್ಷೆ ಚಿನ್ನಸ್ವಾಮಿಯಲ್ಲಿ ಹೈವೋಲ್ಟೇಜ್ ಪಂದ್ಯದ ನಿರೀಕ್ಷೆ,1
ಹೊಸ ಶಿಕ್ಷಣ ನೀತಿಯ ಪರಿಣಾಮಗಳ ಬಗ್ಗೆ ಸುಳ್ಳು ಮಾಹಿತಿ,0
ರಲ್ಲಿ ಆರ್ಥಿಕ ಮಾರುಕಟ್ಟೆಯಲ್ಲಿ ಹೊಸ ಹೂಡಿಕೆ ಬಗ್ಗೆ ತಪ್ಪು ವರದಿ,0
ಕ್ರಿಕೆಟ್ ಇತಿಹಾಸದಲ್ಲೇ​ ಹೊಸ ದಾಖಲೆ​ ನಿರ್ಮಿಸಿದ ಮಿಥಾಲಿ ರಾಜ್,1
ವಿಶ್ರಾಂತಿಯಲ್ಲಿರುವ ದರ್ಶನ್​ ಸಫಾರಿ ಜೀಪ್​ ಏರಿದ್ದೇಕೆ,1
ರಲ್ಲಿ ರಾಜಕೀಯ ಪಕ್ಷದ ಗೆಲುವಿನ ಬಗ್ಗೆ ಸುಳ್ಳು ಸುದ್ದಿ,0
ಮೊದಲ ಪಂದ್ಯದಲ್ಲೆ ತವರಿನಲ್ಲಿ ಗೆದ್ದು ಬೀಗಿದ​ ಹೈದರಾಬಾದ್ ಸನ್​ರೈಸರ್ಸ್​​ಗೆ ವಿಕೆಟ್​ಗಳ ಭರ್ಜರಿ ಜಯ,1
ಭಯ ಹುಟ್ಟಿಸುವ ‘ಪರಿ’ ಹಾರರ್​ ಸಿನಿಮಾದ ಟ್ರೈಲರ್​ ಬಿಡುಗಡೆ,1
ಕೇವಲ ಕ್ರಿಕೆಟ್​​ನಲ್ಲಷ್ಟೆ ಅಲ್ಲಾ ತೆರಿಗೆ ಕಟ್ಟುವಲ್ಲೂ ಧೋನಿ ಉತ್ತಮ ಪ್ಲೇಯರ್,1
ಟೀಂ ಇಂಡಿಯಾ ಟಿ ಸರಣಿ ಗೆಲ್ಲದಿರಲು ಮಳೆ ಕಾರಣವಲ್ಲ ಮತ್ತೇನು,1
ಭಾರತ ವಿರುದ್ಧ ಕೊನೆಯ ಪಂದ್ಯ ಕ್ರಿಕೆಟ್ ವೃತ್ತಿ ಬದುಕಿಗೆ ನಿವೃತ್ತಿ ಘೋಷಿಸಿದ ಅಲೆಸ್ಟರ್ ಕುಕ್,1
ರಲ್ಲಿ ಆರ್ಥಿಕ ಮಾರುಕಟ್ಟೆಯಲ್ಲಿ ಕುಸಿತದ ಬಗ್ಗೆ ತಪ್ಪು ವರದಿ,0
ಆ್ಯಕ್ಷನ್​ ಹೀರೊ ಜಾಕಿಚಾನ್​ ಮಗಳು ಬೀದಿಪಾಲು,1
ಪ್ರಸಿದ್ಧ ಆಟಗಾರನ ತಂಡ ಬದಲಾವಣೆ ಬಗ್ಗೆ ತಪ್ಪು ಸುದ್ದಿ,0
‘ಬಿಗ್​​ಬಾಸ್​’ ಮನೆಯಿಂದ ಹೊರ ನಡೆದ ಎರಡನೇ ಸ್ಪರ್ಧಿ ಇವರೇ,1
ಐಪಿಎಲ್​ನ ತಂಡಗಳ ಹೀರೋಗಳು ಸಾಧನೆಗಳು ಚಿತ್ರ ಸಹಿತ ವಿವರಣೆ,1
ರಲ್ಲಿ ರಾಜಕೀಯ ಪಕ್ಷದ ಸದಸ್ಯರ ಬಂಧನದ ಬಗ್ಗೆ ಸುಳ್ಳು ಸುದ್ದಿ,0
ರಲ್ಲಿ ವೈದ್ಯಕೀಯ ಸಂಶೋಧನೆಯ ಯಶಸ್ಸಿನ ಬಗ್ಗೆ ತಪ್ಪು ಮಾಹಿತಿ,0
ಐಎಸ್​​ಎಸ್​​ಎಫ್ ಚಾಂಪಿಯನ್ ಶಿಪ್​​ನಲ್ಲಿ ಭಾರತಕ್ಕೆ ಮತ್ತೆರಡು ಚಿನ್ನ,1
ಕೇಪ್​ ಟೌನ್​ನ ರಸ್ತೆ ಬದಿಯಲ್ಲಿ ಭರ್ಜರಿಯಾಗಿ ಸ್ಟೆಪ್ಸ್ ಹಾಕಿದ ವಿರಾಟ್ ಅನುಷ್ಕಾ ವೈರಲ್ ಆಗುತ್ತಿದೆ ವಿರುಷ್ಕಾ ಡಾನ್ಸ್,1
ರಾಜಕೀಯ ಪಕ್ಷದ ಸದಸ್ಯರ ಬಂಧನದ ಬಗ್ಗೆ ಸುಳ್ಳು ಸುದ್ದಿ,0
ಪ್ರಸಿದ್ಧ ಗಾಯಕನ ವಿವಾಹದ ಬಗ್ಗೆ ಸುಳ್ಳು ಸುದ್ದಿ,0
ರಲ್ಲಿ ವೈದ್ಯಕೀಯ ಸಂಶೋಧನೆಯ ಯಶಸ್ಸಿನ ಬಗ್ಗೆ ಸುಳ್ಳು ಮಾಹಿತಿ,0
ಏಷ್ಯನ್ ಗೇಮ್ಸ್​​ನಲ್ಲಿ ಬಜರಂಗ್ ಕೊರಳಿಗೆ ಚಿನ್ನದ ಹಾರ ಈಜಿನಲ್ಲಿ ಸಾಜನ್ ಫೈನಲ್​​ಗೆ,1
ರಲ್ಲಿ ವೈದ್ಯಕೀಯ ಉತ್ಪನ್ನದ ಲಾಭದ ಬಗ್ಗೆ ತಪ್ಪು ವರದಿ,0
ಕನ್ನಡ ಬಿಗ್ ಬಾಸ್​ನಲ್ಲಿ ಫಿನಾಲೆಗೆ ಮುನ್ನವೇ ಸಮೀರ್ ಆಚಾರ್ಯ ಔಟ್,1
trailer ಆನೆ ನಡೆದಿದ್ದೇ ದಾರಿ ತಾಕತ್ತಿದ್ದರೆ ಕಟ್ಟಾಕು ಯಜಮಾನ ಮಾಸ್​ ಎಂಟ್ರಿ,1
ಐಪಿಎಲ್ ಡೆಲ್ಲಿ ಡೇರ್ ಡೆವಿಲ್ಸ್ ಹಾಗೂ ಸನ್​ರೈಸರ್ಸ್​​ ಹೈದರಾಬಾದ್ ಪಂದ್ಯಗಳ ನಡುವಣ ಕೆಲ ಫೋಟೋಗಳು,1
ವೈದ್ಯಕೀಯ ಸಂಶೋಧನೆಯ ಅಪಾಯಗಳ ಬಗ್ಗೆ ಸುಳ್ಳು ಮಾಹಿತಿ,0
ಜಾಗದ ಸುತ್ತಳತೆ ಅಳೆಯಲು ಗೂಗಲ್​ ಅರ್ಥ್​ ಹೊಸ ಅಪ್​ಡೇಟ್​,1
ರಾಜಕೀಯ ಪಕ್ಷದ ಸದಸ್ಯರ ರಾಜೀನಾಮೆ ಬಗ್ಗೆ ಸುಳ್ಳು ಸುದ್ದಿ,0
ರಲ್ಲಿ ಆರ್ಥಿಕ ಮಾರುಕಟ್ಟೆಯಲ್ಲಿ ಏರಿಕೆ ಬಗ್ಗೆ ತಪ್ಪು ಮಾಹಿತಿ,0
ಶ್ರುತಿ ವಿರುದ್ಧದ ಮಾನನಷ್ಟ ಮೊಕದ್ದಮೆ ಪ್ರಕರಣದ ವಿಚಾರಣೆ ಕ್ಕೆ ಮುಂದೂಡಿಕೆ,1
photos ಮತ್ತೆ ವೈರಲ್​ ಆಗುತ್ತಿವೆ ದೀಪ್​ವೀರ್​ ರೊಮ್ಯಾಂಟಿಕ್​ ಫೋಟೋಗಳು,1
ಭಾರತದ ವಿರುದ್ಧ ಸರಣಿಗೆ ನ್ಯೂಜಿಲ್ಯಾಂಡ್​ ತಂಡ ಪ್ರಕಟ ಟೀಂ ಇಂಡಿಯಾಗೆ ಕಬ್ಬಿಣದ ಕಡಲೆ ಆಗಲಿದೆಯೇ ಕಿವೀಸ್,1
ರಾಜಕೀಯ ನಾಯಕನ ಹೊಸ ಯೋಜನೆ ಯಶಸ್ವಿಯಾಗಿದೆ ತಪ್ಪು ಸುದ್ದಿ,0
ರಲ್ಲಿ ಆರ್ಥಿಕ ಮಾರುಕಟ್ಟೆಯಲ್ಲಿ ಕುಸಿತದ ಬಗ್ಗೆ ತಪ್ಪು ಮಾಹಿತಿ,0
ನ್ಯೂಸ್​ ಕನ್ನಡದ ಜೊತೆ ಕೆಜಿಎಫ್​ ಅಮ್ಮ​ ಅರ್ಚನಾ ಮಾತು ನಿರೀಕ್ಷಿಸಿ ಯಶೋಮಾತೆ,1
ವಿಶ್ವ ರಂಗಭೂಮಿ ದಿನದ ಅಂಗವಾಗಿ ಹಳೇ ಫೋಟೋಗಳನ್ನು ಟ್ವಿಟರ್​ನಲ್ಲಿ ಪ್ರಕಟಿಸಿದ ಬಿಗ್​ಬಿ ಅಮಿತಾಭ್​ ನವಾಜುದ್ದೀನ್​,1
ವೈದ್ಯಕೀಯ ಉತ್ಪನ್ನದ ಲಾಭದ ಬಗ್ಗೆ ಸುಳ್ಳು ಸುದ್ದಿ,0
ಮೌನ ಮುರಿದ ಕಾರ್ತಿಕ್ ಸಿಂಗಲ್ ರನ್ ನಿರಾಕರಿಸಿದ ಬಗ್ಗೆ ಸ್ಪಷ್ಟನೆ ನೀಡಿದ ಡಿಕೆ,1
ರಲ್ಲಿ ವೈದ್ಯಕೀಯ ಸಂಶೋಧನೆಯ ಯಶಸ್ಸಿನ ಬಗ್ಗೆ ತಪ್ಪು ವರದಿ,0
ರಲ್ಲಿ ಆರ್ಥಿಕ ಮಾರುಕಟ್ಟೆಯಲ್ಲಿ ಬಂಡವಾಳ ಹೂಡಿಕೆ ಬಗ್ಗೆ ಸುಳ್ಳು ವರದಿ,0
ಇನ್​ಸ್ಟಾಗ್ರಾಂ ಪೋಸ್ಟ್​ನಲ್ಲಿ ಒಂದು ಪೋಸ್ಟ್​ಗೆ ಲಕ್ಷ ಲಕ್ಷ ಪಡೆಯುವ ಪ್ರಿಯಾ ವಾರಿಯರ್,1
ಭಾರತ ಆಸೀಸ್ ಅಭ್ಯಾಸ ಪಂದ್ಯ ಮಳೆಯಿಂದ ಮೊದಲ ದಿನದಾಟ ರದ್ದು,1
ಪ್ರಖ್ಯಾತ ಕಂಪೆನಿಯಲ್ಲಿ ಬಾಸ್​ಗಿಂತ ನೌಕರರೇ ಹೆಚ್ಚು ಆದಾಯ ಗಳಿಸುತ್ತಾರೆ,1
ರಲ್ಲಿ ಆರ್ಥಿಕ ಮಾರುಕಟ್ಟೆಯಲ್ಲಿ ಬಂಡವಾಳ ಹೂಡಿಕೆ ಬಗ್ಗೆ ತಪ್ಪು ವರದಿ,0
ರಲ್ಲಿ ರಾಜಕೀಯ ನಾಯಕನ ಬಂಧನದ ಬಗ್ಗೆ ತಪ್ಪು ಸುದ್ದಿ,0
‘ಕೆಜಿಎಫ್ ’ನಲ್ಲಿ ಸಂಜಯ್ ದತ್ ನಟಿಸ್ತಾರಾ ಹೌದು ಅಂತಾರೆ ಯಶ್,1
ರಲ್ಲಿ ಆರ್ಥಿಕ ಹೂಡಿಕೆ ಬಗ್ಗೆ ತಪ್ಪು ಮಾಹಿತಿ,0
photos ಬಾಲಿವುಡ್​ ಕನಸು ಕಾಣುತ್ತಿರುವ ಕಿರುತೆರೆ ನಟಿಯ ಬಿಕಿನಿ ಫೋಟೋಶೂಟ್​,1
ರಲ್ಲಿ ಆರ್ಥಿಕ ಹೂಡಿಕೆ ಬಗ್ಗೆ ತಪ್ಪು ವರದಿ,0
ರಲ್ಲಿ ಆರ್ಥಿಕ ಮಾರುಕಟ್ಟೆಯಲ್ಲಿ ಏರಿಕೆ ಬಗ್ಗೆ ತಪ್ಪು ವರದಿ,0
ಲಕ್ಷ್ಯ ಸೇನ್ ವರ್ಷದ ಬಾಲಕ ಭಾರತದ ನೂತನ ಬ್ಯಾಡ್ಮಿಂಟನ್ ಸೆನ್ಸೇಷನ್,1
ರಲ್ಲಿ ಆರ್ಥಿಕ ಹೂಡಿಕೆ ಬಗ್ಗೆ ತಪ್ಪು ವರದಿ,0
ಪುನೀತ್​ ಧ್ವನಿಯಲ್ಲಿ ವಾಸು ಪಕ್ಕಾ ಕಮರ್ಷಿಯಲ್ ಸಿನಿಮಾದ ಹಾಡು,1
ರಲ್ಲಿ ಪ್ರಸಿದ್ಧ ಗಾಯಕನ ವಿವಾಹದ ಬಗ್ಗೆ ತಪ್ಪು ವರದಿ,0
ನೂತನ ಜಿಯೋ ಫೋನ್ ಬಿಡುಗಡೆ ಇದರಲ್ಲಿದೆ ಸ್ಪೆಷಲ್ ಫೀಚರ್ಸ್​,1
ರಲ್ಲಿ ಹೊಸ ಟೆಕ್ ಕಂಪನಿಯ ipo ಬಗ್ಗೆ ತಪ್ಪು ಮಾಹಿತಿ,0
icc ಅವಾರ್ಡ್ಸ್​ಗಳಲ್ಲಿ ಮಿಂಚಿದ ಟೀಂ ಇಂಡಿಯಾ ಯಾರಿಗೆ ಪ್ರಶಸ್ತಿ ಗೊತ್ತಾ,1
ರಲ್ಲಿ ರಾಜಕೀಯ ನಾಯಕನ ಬಂಧನದ ಬಗ್ಗೆ ತಪ್ಪು ಸುದ್ದಿ,0
ವೈದ್ಯಕೀಯ ಉತ್ಪನ್ನದ ಲಾಭದ ಬಗ್ಗೆ ಸುಳ್ಳು ಸುದ್ದಿ,0
ರಲ್ಲಿ ಪ್ರಸಿದ್ಧ ನಟನ ರಾಜಕೀಯ ಪ್ರವೇಶದ ಬಗ್ಗೆ ತಪ್ಪು ವರದಿ,0
ರಲ್ಲಿ ಪ್ರಸಿದ್ಧ ಗಾಯಕನ ಹೊಸ ಆಲ್ಬಮ್ ಬಗ್ಗೆ ಸುಳ್ಳು ಸುದ್ದಿ,0
ರಲ್ಲಿ ರಾಜಕೀಯ ಪಕ್ಷದ ಗೆಲುವಿನ ಬಗ್ಗೆ ಸುಳ್ಳು ಸುದ್ದಿ,0
ಮತ್ತೆ ಟ್ವಿಟರ್​ ಸಿಟ್ಟಾದ ಬಾಲಿವುಡ್​ ಬಿಗ್​ಬಿ ಅಮಿತಾಭ್​ ಬಚ್ಚನ್​,1
ರಲ್ಲಿ ರಾಜಕೀಯ ನಾಯಕನ ರಾಜೀನಾಮೆ ಬಗ್ಗೆ ತಪ್ಪು ಸುದ್ದಿ,0
ರಲ್ಲಿ ರಾಜಕೀಯ ನಾಯಕನ ಬಂಧನದ ಬಗ್ಗೆ ಸುಳ್ಳು ಸುದ್ದಿ,0
india vs australia live cricket score ರೋಚಕ ಪಂದ್ಯದಲ್ಲಿ ಗೆದ್ದು ಬೀಗಿದ ಭಾರತ,1
ಅನುಷ್ಕಾ ಶರ್ಮಾರಿಂದ ಬೈಗುಳ ತಿಂದ ವ್ಯಕ್ತಿ ಗೊತ್ತಾ,1
ಅಪ್​ಡೇಟ್ ಆಗಲಿದೆ ವಾಟ್ಸಪ್ ಹಳೆಯ ಸಂದೇಶ ವಿಡಿಯೋಗಳನ್ನು ಸೇವ್​ ಮಾಡಿಕೊಳ್ಳಿ,1
ರಲ್ಲಿ ಸಾಮಾಜಿಕ ಜಾಲತಾಣದಲ್ಲಿ ಹರಡಿದ ಸುಳ್ಳು ಫೋಟೋಗಳು,0
ಕರ್ನಾಟಕದಲ್ಲೂ ಗೋ ಬ್ಯಾಕ್​ ಮೋದಿ ಆಂದೋಲನ ಆಗುತ್ತೆ ಬಿಜೆಪಿ ನಾಯಕರ ವಿರುದ್ಧ ಖುಷ್ಬೂ ಕಿಡಿ,1
ಭಾರತ ಫುಟ್‌ಬಾಲ್ ತಂಡ ಏಷ್ಯಾ ಕಪ್ ಗೆದ್ದಿತು,1
ಕಯಾಮತ್​ ಸೆ ಕಯಾಮತ್​ ತಕ್ ​ನಲ್ಲಿ ಯಾರಿಗೂ ಇಷ್ಟವಾಗಿರಲಿಲ್ಲ ಅಮೀರ್​ ಖಾನ್​,1
ಬ್ಯಾಟಿಂಗ್ ಬೌಲಿಂಗ್​ನಲ್ಲಿ ಮಿಂಚಿದ ಭಾರತ ದಿನದಾಟದ ಅಂತ್ಯಕ್ಕೆ ವಿಂಡೀಸ್,1
ಮೆಕಲಮ್ ಸಾವಿನ ಸುದ್ದಿಗೆ ಟ್ವಿಸ್ಟ್​​ ಜೀವಂತವಾಗಿದ್ದೇನೆ ಎಂದ ನ್ಯೂಜಿಲೆಂಡ್ ಕ್ರಿಕೆಟರ್,1
ರಲ್ಲಿ ವೈದ್ಯಕೀಯ ಸಂಶೋಧನೆಯ ಯಶಸ್ಸಿನ ಬಗ್ಗೆ ತಪ್ಪು ಮಾಹಿತಿ,0
ಆರ್ಥಿಕ ಮಾರುಕಟ್ಟೆಯಲ್ಲಿ ಬಂಡವಾಳ ಹೂಡಿಕೆ ಬಗ್ಗೆ ಸುಳ್ಳು ಮಾಹಿತಿ,0
ಅಯ್ಯೋ ಟೀಂ ಇಂಡಿಯಾ ಕೋಚ್ ರವಿ ಶಾಸ್ತ್ರಿಗೆ ಇಂತಾ ಗತಿ ಬಂತಾ,1
ಶನಿಕಥೆ ಧಾರಾವಾಹಿ ಇತಿಹಾಸದಲ್ಲೇ ದೊಡ್ಡ ಸಂಚಲನ ಭಾಗ,1
ರಾಜಕೀಯ ಪಕ್ಷದ ಸದಸ್ಯರ ರಾಜೀನಾಮೆ ಬಗ್ಗೆ ಸುಳ್ಳು ಸುದ್ದಿ,0
ಟೀಂ ಇಂಡಿಯಾಕ್ಕೆ ಶುಭಕೋರಿ ಟ್ರೋಲಿಗರಿಗೆ ಆಹಾರವಾದ ಕಾಂಗ್ರೆಸ್,1
ಪ್ರಸಿದ್ಧ ವ್ಯಕ್ತಿಯ ಬಂಧನದ ಬಗ್ಗೆ ಸುಳ್ಳು ವರದಿ,0
ಸಿನಿಮಾ ಬಿಡುಗಡೆಗೆ ಸಂಬಂಧಿಸಿದ ತಪ್ಪು ದಿನಾಂಕ,0
ರಲ್ಲಿ ವೈದ್ಯಕೀಯ ಉತ್ಪನ್ನದ ಲಾಭದ ಬಗ್ಗೆ ತಪ್ಪು ವರದಿ,0
ಹತ್ತನೇ ಬೆಂಗಳೂರು ಅಂತರರಾಷ್ಟ್ರೀಯ ಚಲನಚಿತ್ರೋತ್ಸವಕ್ಕೆ ಇಂದು ಚಾಲನೆ,1
ರಲ್ಲಿ ಆರ್ಥಿಕ ಮಾರುಕಟ್ಟೆಯಲ್ಲಿ ಬಂಡವಾಳ ಹೂಡಿಕೆ ಬಗ್ಗೆ ತಪ್ಪು ಮಾಹಿತಿ,0
ರಲ್ಲಿ ಪ್ರಸಿದ್ಧ ಗಾಯಕನ ಹೊಸ ಆಲ್ಬಮ್ ಬಗ್ಗೆ ಸುಳ್ಳು ಸುದ್ದಿ,0
ರಲ್ಲಿ ಪ್ರಸಿದ್ಧ ಗಾಯಕನ ಹೊಸ ಆಲ್ಬಮ್ ಬಗ್ಗೆ ಸುಳ್ಳು ಸುದ್ದಿ,0
ದಸರಾ ಭರ್ಜರಿ ಆಫರ್ ಸ್ಯಾಮ್​ಸಂಗ್ ಮೊಬೈಲ್​ ಸಿಗುತ್ತಿದೆ ಸಾವಿರ ರೂ ರಿಯಾಯಿತಿ,1
ಪ್ರಾಣಿಪ್ರೇಮಿ ದರ್ಶನ್​ ಮೈಸೂರು ಮೃಗಾಲಯದ ರಾಯಭಾರಿ,1
ರಲ್ಲಿ ರಾಜಕೀಯ ಪಕ್ಷದ ಸದಸ್ಯರ ರಾಜೀನಾಮೆ ಬಗ್ಗೆ ಸುಳ್ಳು ಸುದ್ದಿ,0
live ಐಪಿಎಲ್​ ರಾಜಸ್ಥಾನ್ ರಾಯಲ್ಸ್​ vs ಕಿಂಗ್ಸ್​ ಇಲೆವೆನ್ ಪಂಜಾಬ್​ ರಾಜಸ್ಥಾನಕ್ಕೆ ರನ್​ಗಳ ಭರ್ಜರಿ ಜಯ,1
ಪಾತ್ರಕ್ಕಾಗಿ ಪಲ್ಲಂಗ ತನುಶ್ರೀ ಮಾಡಿರುವ ಲೈಂಗಿಕ ಕಿರುಕುಳ ಆರೋಪ ಸುಳ್ಳು ಎಂದ ನಾನಾ ಪಾಟೇಕರ್​,1
ಪ್ರಸಿದ್ಧ ವ್ಯಕ್ತಿಯ ಬಂಧನದ ಬಗ್ಗೆ ತಪ್ಪು ವರದಿ,0
ರಲ್ಲಿ ವೈದ್ಯಕೀಯ ಉತ್ಪನ್ನದ ಲಾಭದ ಬಗ್ಗೆ ತಪ್ಪು ವರದಿ,0
ತಿ ಮು ಅಂತೆಲ್ಲಾ ಬೈದ್ರಂತೆ ನಾಗತಿಹಳ್ಳಿ ಚಂದ್ರಶೇಖರ್ ವಿರುದ್ಧ ಮಾನನಷ್ಟ ಮೊಕದ್ದಮೆ,1
ಮೊದಲ ಏಕದಿನ ಪಂದ್ಯ ರಬಡಾ ಶಮ್ಸಿ ದಾಳಿಗೆ ಲಂಕಾ ತತ್ತರ ಆಫ್ರಿಕಾಕ್ಕೆ ವಿಕೆಟ್​ಗಳ ಜಯ,1
ರಲ್ಲಿ ಪ್ರಸಿದ್ಧ ಗಾಯಕನ ಹೊಸ ಸಂಗೀತ ಕಾರ್ಯಕ್ರಮದ ಬಗ್ಗೆ ಸುಳ್ಳು ವರದಿ,0
ಸಿನಿಮಾ ನಟಿಯ ಹೊಸ ಚಿತ್ರ ಬಿಡುಗಡೆ ಬಗ್ಗೆ ತಪ್ಪು ವರದಿ,0
ಆಫ್ರಿಕಾ ಮಹಿಳಾ ಕ್ರಿಕೆಟ್ ತಂಡದಲ್ಲಿ ಸಲಿಂಗ ವಿವಾಹ ಸಹ ಆಟಗಾರ್ತಿ ಜೊತೆ ಕ್ಯಾಪ್ಟನ್ ಪ್ರೇಮ ಪ್ರಸಂಗ,1
ಕೊಹ್ಲಿಯನ್ನು ಪಕ್ಕಕ್ಕಿಟ್ಟರೆ ಟೀಂ ಇಂಡಿಯಾ ಬಲ ಶೇ ರಷ್ಟು ಮಾತ್ರ ಪಾಕ್ ಕ್ರಿಕೆಟಿಗ,1
ಬಿ ಟೌನ್​ನಲ್ಲಿ ವರ್ಷ ಪೂರೈಸಿದ ಕಿಂಗ್​ ಖಾನ್​ ಶಾರುಖ್​,1
ಒಂದೇ ಓವರಿನಲ್ಲಿ ರನ್ ಸಿಡಿಸಿ ಹೊಸ ದಾಖಲೆ ಬರೆದ ಜೆ ಪಿ ಡುಮಿನಿ,1
ರಲ್ಲಿ ಪ್ರಸಿದ್ಧ ವ್ಯಕ್ತಿಯ ಬಂಧನದ ಬಗ್ಗೆ ತಪ್ಪು ಸುದ್ದಿ,0
ಏಷ್ಯಾ ಕಪ್ ಟೀಂ ಇಂಡಿಯಾ ಪ್ರಕಟ ಆಟಗಾರರಿಗೆ ಸ್ಥಾನ ಸಾಧ್ಯತೆ,1
ರಲ್ಲಿ ವೈದ್ಯಕೀಯ ಸಂಶೋಧನೆಯ ಯಶಸ್ಸಿನ ಬಗ್ಗೆ ತಪ್ಪು ಮಾಹಿತಿ,0
ಭಾರತ ಇಂಗ್ಲೆಂಡ್ ನಡುವಣ ಮೂರನೇ ಏಕದಿನ ಪಂದ್ಯದ ಕೆಲ ಚಿತ್ರಪಟಗಳು,1
ಹೊಸ ಶಿಕ್ಷಣ ನೀತಿಯ ಬಗ್ಗೆ ತಪ್ಪು ಮಾಹಿತಿ,0
ಬಿಡುಗಡೆಯಾಗಲಿರುವ ರಿಷಬ್​ ಶೆಟ್ಟಿ ನಟನೆಯ ‘ಬೆಲ್​ ಬಾಟಂ’ ಚಿತ್ರ ನೋಡಲು ಐದು ಕಾರಣಗಳು,1
ರಲ್ಲಿ ಆರ್ಥಿಕ ಮಾರುಕಟ್ಟೆಯಲ್ಲಿ ಹೂಡಿಕೆದಾರರ ಬಗ್ಗೆ ತಪ್ಪು ಮಾಹಿತಿ,0
ರಲ್ಲಿ ವೈದ್ಯಕೀಯ ಸಂಶೋಧನೆಯ ಯಶಸ್ಸಿನ ಬಗ್ಗೆ ಸುಳ್ಳು ಮಾಹಿತಿ,0
ಟಾಲಿವುಡ್‍ನ ಬಿಗ್ ಸಿನಿಮಾ ಮೆಹಬೂಬ ದಲ್ಲಿ ನೇಹಾ ಶೆಟ್ಟಿ ಮಳೆ ಹುಡುಗಿ ಅದೃಷ್ಟ ಬದಲಾಗುತ್ತಾ,1
ರಲ್ಲಿ ರಾಜಕೀಯ ನಾಯಕನ ಹೊಸ ಯೋಜನೆ ಬಗ್ಗೆ ಸುಳ್ಳು ಸುದ್ದಿ,0
photos ಅಮಿತಾಭ್ ಬಚ್ಚನ್ ಮೊಮ್ಮಗನ ಫೋಟೋ ಸಖತ್ ವೈರಲ್,1
ರಲ್ಲಿ ಹೊಸ ಶಿಕ್ಷಣ ನೀತಿಯ ಪರಿಣಾಮಗಳ ಬಗ್ಗೆ ಸುಳ್ಳು ಮಾಹಿತಿ,0
