text,label
ಲೌಡ್ ಆಗಿ ಬರ್ತಿದೆ ಲೌಡ್‍ಸ್ಪೀಕರ್ ಎರಡು ಲಕ್ಷ ಜನರ ಸಮ್ಮುಖದಲ್ಲಿ ಟೈಟಲ್ ಬಿಡುಗಡೆ,1
ಆರ್ಥಿಕ ಹೂಡಿಕೆ ಬಗ್ಗೆ ಸುಳ್ಳು ಮಾಹಿತಿ,0
ರಲ್ಲಿ ಆರ್ಥಿಕ ಹೂಡಿಕೆ ಬಗ್ಗೆ ತಪ್ಪು ಮಾಹಿತಿ,0
ಯಜಮಾನ vs ಮಿಠಾಯಿ ಸೂರಿ ಖತರ್ನಾಕ್ ಖಳನಾಗಿ ಡಾಲಿ ಧನಂಜಯ್,1
ಐಪಿಎಲ್ ರಿಷಭ್ ಪಂತ್ ಶ್ರೇಯಸ್ ಅಯ್ಯರ್ ಆರ್ಭಟ ಮಳೆಬಾಧಿತ ಪಂದ್ಯದಲ್ಲಿ ಡೆಲ್ಲಿಗೆ ರನ್‌ಗಳ ರೋಚಕ ಗೆಲುವು,1
ರಲ್ಲಿ ರಾಜಕೀಯ ಪಕ್ಷದ ಗೆಲುವಿನ ಬಗ್ಗೆ ಸುಳ್ಳು ವರದಿ,0
ಪ್ರಸಿದ್ಧ ಆಟಗಾರನ ನಿವೃತ್ತಿ ಬಗ್ಗೆ ಸುಳ್ಳು ಸುದ್ದಿ,0
ರಲ್ಲಿ ಪ್ರಸಿದ್ಧ ಗಾಯಕನ ವಿವಾಹದ ಬಗ್ಗೆ ತಪ್ಪು ವರದಿ,0
ಮೋದಿ ಕಾಕಾ ಕಾ ಗಾಂವ್ ತಿಂಗಳ ಹೋರಾಟದ ಬಳಿಕ ಬೆಳ್ಳಿ ತೆರೆಗೆ,1
ಟಿ ತ್ರಿಕೋನ ಸರಣಿ ಬಾಂಗ್ಲಾ ವಿರುದ್ಧ ಭಾರತಕ್ಕೆ ವಿಕೆಟ್ ಭರ್ಜರಿ ಜಯ,1
ಐಸ್ ಕ್ರಿಕೆಟ್​ನಲ್ಲೂ ಅಖ್ತರ್​ಗೆ ಸಿಕ್ಸರ್ ಎತ್ತಿದ ಸೆಹ್ವಾಗ್,1
ರಲ್ಲಿ ಆರ್ಥಿಕ ಮಾರುಕಟ್ಟೆಯಲ್ಲಿ ಹೂಡಿಕೆದಾರರ ಬಗ್ಗೆ ತಪ್ಪು ಮಾಹಿತಿ,0
ಮಾರುಕಟ್ಟೆಗೆ ಅಪ್ಪಳಿಸಲಿದೆ ಮರ್ಸಿಡಸ್ ಎಸ್ ಶ್ರೇಣಿಯ ಹೊಸ ಕಾರ್,1
ರಲ್ಲಿ ವೈದ್ಯಕೀಯ ಸಂಶೋಧನೆಯ ಅಪಾಯಗಳ ಬಗ್ಗೆ ಸುಳ್ಳು ಮಾಹಿತಿ,0
ರಲ್ಲಿ ರಾಜಕೀಯ ಪಕ್ಷದ ಸದಸ್ಯರ ರಾಜೀನಾಮೆ ಬಗ್ಗೆ ತಪ್ಪು ವರದಿ,0
ನೇ ಟೆಸ್ಟ್​ ಕ್ಕೆ ಪೂಜಾರ ಔಟ್​ ಕ್ಕೆ ವಿಕೆಟ್​ ಕಳೆದುಕೊಂಡ ಭಾರತ,1
ಅಭ್ಯಾಸ ಪಂದ್ಯದಲ್ಲಿ ಕೊಹ್ಲಿ ಧವನ್ ಸಖತ್ ಸ್ಟೆಪ್ಸ್ ವಿಡಿಯೋ ವೈರಲ್,1
ಸಿನಿಮಾ ನಟಿಯ ವಿವಾಹದ ಬಗ್ಗೆ ತಪ್ಪು ವರದಿ,0
video ವೈರಲ್​ ಆಯಿತು ಕುದುರೆಯೊಂದಿಗೆ ರೇಸ್​ ಮಾಡಿದ ಸಲ್ಮಾನ್​ ಖಾನ್​ ವಿಡಿಯೋ,1
ಭಾರತ ಆಫ್ರಿಕಾ ತಂಡಗಳ ನೇ ಟೆಸ್ಟ್ ಡ್ರಾದಲ್ಲಿ ಅಂತ್ಯ ಭಾರತಕ್ಕೆ ಸರಣಿ ಜಯ,1
ಸಿನಿಮಾ ನಟಿಯ ವಿವಾಹದ ಬಗ್ಗೆ ಸುಳ್ಳು ಸುದ್ದಿ,0
ಹೊಸ ಶಿಕ್ಷಣ ನೀತಿಯ ಅನುಷ್ಠಾನ ಬಗ್ಗೆ ಸುಳ್ಳು ಮಾಹಿತಿ,0
ರಲ್ಲಿ ವೈದ್ಯಕೀಯ ಸಂಶೋಧನೆಯ ಅಪಾಯಗಳ ಬಗ್ಗೆ ಸುಳ್ಳು ಮಾಹಿತಿ,0
ರಲ್ಲಿ ಹೊಸ ಟೆಕ್ ಉತ್ಪನ್ನದಲ್ಲಿ ಅಪಾಯವಿದೆ ಸುಳ್ಳು ಸುದ್ದಿ,0
ವೈದ್ಯಕೀಯ ಸಂಶೋಧನೆಯ ಯಶಸ್ಸಿನ ಬಗ್ಗೆ ಸುಳ್ಳು ಮಾಹಿತಿ,0
ನೆಟ್​ಫ್ಲಿಕ್ಸ್​ನಲ್ಲಿ ಬರಲಿದೆ ಬಾಹುಬಲಿ ಪ್ರೀಕ್ವೆಲ್​ ಸೀರೀಸ್,1
ರಲ್ಲಿ ಹೊಸ ಟೆಕ್ ಉತ್ಪನ್ನದಲ್ಲಿ ಅಪಾಯವಿದೆ ಸುಳ್ಳು ಸುದ್ದಿ,0
ಸಲ ಕಪ್​​ ನಮ್ದೆ ಆಗ್ಬೇಕಾದ್ರೆ ಆಟಗಾರರು ಆರ್​ಸಿಬಿ ತಂಡ ಸೇರಬೇಕು,1
ಕೆಜಿಎಫ್​ ವಿಮರ್ಶೆ ಚಿತ್ರದಲ್ಲಿ ಯಶ್ ಒಬ್ಬರೇ ಹೀರೋ ಅಲ್ಲ,1
ಟ್ರೋಲ್​ಗೆ ಬಲಿಯಾದ ಜಾನ್ಹವಿ ಕಪೂರ್​ ಅಭಿನಯದ ಧಡಕ್​ ಸಿನಿಮಾ ಟ್ರೇಲರ್​,1
ತೆರೆ ಕಿಚ್ಚು ಹಚ್ಚೋಕೆ ಅಂಬಿಗೆ ಜೊತೆಯಾಗಲಿದ್ದಾರೆ ಕಿಚ್ಚ ಸುದೀಪ್​,1
ವೈದ್ಯಕೀಯ ಉತ್ಪನ್ನದ ಪರಿಣಾಮಗಳ ಬಗ್ಗೆ ತಪ್ಪು ಸುದ್ದಿ,0
photos ಲಡಾಕ್​ನ ರಸ್ತೆಗಳಲ್ಲಿ ಮೊಬೈಲ್​ ಕ್ಯಾಮೆರಾ ಕಣ್ಣಿಗೆ ಸೆರೆ ಸಿಕ್ಕ ಪ್ರಕೃತಿಯ ಸೌಂದರ್ಯ,1
ರಲ್ಲಿ ಆರ್ಥಿಕ ಹೂಡಿಕೆ ಬಗ್ಗೆ ತಪ್ಪು ವರದಿ,0
ಆಸೀಸ್ ವಿರುದ್ಧ ನೇ ಟಿ ಮಳೆಗೆ ಆಹುತಿ ಸರಣಿ ಗೆಲ್ಲುವ ಟೀಂ ಇಂಡಿಯಾ ಕನಸು ಭಗ್ನ,1
ಪ್ರಸಿದ್ಧ ಆಟಗಾರನ ತಂಡ ಬದಲಾವಣೆ ಬಗ್ಗೆ ತಪ್ಪು ಸುದ್ದಿ,0
ದೀಪಿಕಾ ರಣವೀರ್​ ಮದುವೆ ಬಗ್ಗೆ ನಿಮಗೆಷ್ಟು ಗೊತ್ತು,1
ರಲ್ಲಿ ವೈದ್ಯಕೀಯ ಉತ್ಪನ್ನದ ಲಾಭದ ಬಗ್ಗೆ ತಪ್ಪು ವರದಿ,0
ರಲ್ಲಿ ರಾಜಕೀಯ ನಾಯಕನ ಬಂಧನದ ಬಗ್ಗೆ ಸುಳ್ಳು ಸುದ್ದಿ,0
ದೀಪಿಕಾ ಅಪ್ಪ ಪ್ರಕಾಶ್​ ಪಡುಕೋಣೆ ನಿದ್ದೆ ಕದ್ದಿದ್ದ ಬಾಲಿವುಡ್ ಬಾಲೆ ಗೋತ್ತಾ,1
ರಲ್ಲಿ ರಾಜಕೀಯ ಪಕ್ಷದ ಸದಸ್ಯರ ಬಂಧನದ ಬಗ್ಗೆ ಸುಳ್ಳು ಸುದ್ದಿ,0
ರಲ್ಲಿ ಸಾಮಾಜಿಕ ಜಾಲತಾಣದಲ್ಲಿ ಹರಡಿದ ಸುಳ್ಳು ವಿಡಿಯೋ,0
ರಲ್ಲಿ ರಾಜಕೀಯ ಪಕ್ಷದ ಗೆಲುವಿನ ಬಗ್ಗೆ ಸುಳ್ಳು ವರದಿ,0
ಮತ್ತೊಂದು ತೆಲುಗು ಸಿನಿಮಾದಲ್ಲಿ ಕಿಚ್ಚ ಮೆಗಾಸ್ಟಾರ್​ ಜತೆ ತೆರೆ ಹಂಚಿಕೊಳ್ಳಲಿರುವ ಸುದೀಪ್​,1
ಅಂಬಿ ಆಸ್ತಿ ದೌರ್ಬಲ್ಯ ಕುಚುಕು ಗೆಳೆಯನ ಕುರಿತು ವಿಷ್ಣುವರ್ಧನ್ ಅಂತರಾಳ,1
ಸಿನಿಮಾ ನಟನ ಮರಣದ ಬಗ್ಗೆ ತಪ್ಪು ವರದಿ,0
ರಲ್ಲಿ ಪ್ರಸಿದ್ಧ ಆಟಗಾರನ ನಿವೃತ್ತಿ ಬಗ್ಗೆ ಸುಳ್ಳು ಸುದ್ದಿ,0
ರಲ್ಲಿ ಹೊಸ ಶಿಕ್ಷಣ ನೀತಿಯ ಪರಿಣಾಮಗಳ ಬಗ್ಗೆ ಸುಳ್ಳು ಮಾಹಿತಿ,0
ರಲ್ಲಿ ಸಾಮಾಜಿಕ ಜಾಲತಾಣದಲ್ಲಿ ಹರಡಿದ ಸುಳ್ಳು ವಿಡಿಯೋ,0
ರಲ್ಲಿ ವೈದ್ಯಕೀಯ ಉತ್ಪನ್ನದ ಲಾಭದ ಬಗ್ಗೆ ತಪ್ಪು ಸುದ್ದಿ,0
ರಲ್ಲಿ ವೈದ್ಯಕೀಯ ಉತ್ಪನ್ನದ ಲಾಭದ ಬಗ್ಗೆ ತಪ್ಪು ವರದಿ,0
ಸಾಮಾಜಿಕ ಜಾಲತಾಣದಲ್ಲಿ ಹರಡಿದ ಸುಳ್ಳು ಆಡಿಯೋ ಕ್ಲಿಪ್,0
ರಲ್ಲಿ ರಾಜಕೀಯ ಪಕ್ಷದ ಸದಸ್ಯರ ರಾಜೀನಾಮೆ ಬಗ್ಗೆ ಸುಳ್ಳು ಸುದ್ದಿ,0
ರಲ್ಲಿ ರಾಜಕೀಯ ಪಕ್ಷದ ಗೆಲುವಿನ ಬಗ್ಗೆ ತಪ್ಪು ಸುದ್ದಿ,0
ರಲ್ಲಿ ಆರ್ಥಿಕ ಮಾರುಕಟ್ಟೆಯಲ್ಲಿ ಹೊಸ ಹೂಡಿಕೆ ಬಗ್ಗೆ ತಪ್ಪು ವರದಿ,0
ರಲ್ಲಿ ಪ್ರಸಿದ್ಧ ಗಾಯಕನ ಹೊಸ ಸಂಗೀತ ಕಾರ್ಯಕ್ರಮದ ಬಗ್ಗೆ ಸುಳ್ಳು ವರದಿ,0
ರಲ್ಲಿ ರಾಜಕೀಯ ಪಕ್ಷದ ಗೆಲುವಿನ ಬಗ್ಗೆ ಸುಳ್ಳು ವರದಿ,0
photos ಕರ್ವ ಚೌತಿ ವಿಶೇಷ ದಿನದಂದು ಅನುಷ್ಕಾ ವಿರಾಟ್​,1
ರಲ್ಲಿ ರಾಜಕೀಯ ಪಕ್ಷದ ಸದಸ್ಯರ ರಾಜೀನಾಮೆ ಬಗ್ಗೆ ತಪ್ಪು ವರದಿ,0
ಟೆಕ್ ಕಂಪನಿ ಹೊಸ ಉತ್ಪನ್ನ ಬಿಡುಗಡೆ,1
ಹೊಸ ಶಿಕ್ಷಣ ನೀತಿಯ ಪರಿಣಾಮಗಳ ಬಗ್ಗೆ ಸುಳ್ಳು ಮಾಹಿತಿ,0
ವಾಟ್ಸಪ್ ಎಚ್ಚರಿಕೆ ಸಂದೇಶಗಳನ್ನು ಗೂಗಲ್ ಡ್ರೈವ್​ನಲ್ಲಿ ಸೇವ್ ಮಾಡಿಕೊಳ್ಳಿ,1
ನೀವೂ ಹಾಲಿವುಡ್​ಗೆ ಹಾರಬೇಕಾ ಹಾಗಿದ್ದರೆ ವರದಿ ಓದಿ,1
ರಲ್ಲಿ ಆರ್ಥಿಕ ಮಾರುಕಟ್ಟೆಯಲ್ಲಿ ಬಂಡವಾಳ ಹೂಡಿಕೆ ಬಗ್ಗೆ ತಪ್ಪು ಮಾಹಿತಿ,0
ಭರ್ಜರಿ ಫೋಟೋಶೂಟ್‌ನಲ್ಲಿ ಬಿಗ್‌ಬಾಸ್‌ ಬೇಬಿ ರಾಯಲ್​ ಲುಕ್​ನಲ್ಲಿ ನಿವೇದಿತಾ ಗೌಡ,1
ರಲ್ಲಿ ರಾಜಕೀಯ ಪಕ್ಷದ ಗೆಲುವಿನ ಬಗ್ಗೆ ಸುಳ್ಳು ವರದಿ,0
ಸಾಮಾಜಿಕ ಜಾಲತಾಣದಲ್ಲಿ ಹರಡಿದ ಸುಳ್ಳು ಫೋಟೋಗಳು,0
ಹೊಸ ಶಿಕ್ಷಣ ನೀತಿಯ ಬಗ್ಗೆ ಸುಳ್ಳು ಮಾಹಿತಿ,0
ರಲ್ಲಿ ಆರ್ಥಿಕ ಮಾರುಕಟ್ಟೆಯಲ್ಲಿ ಏರಿಕೆ ಬಗ್ಗೆ ತಪ್ಪು ಮಾಹಿತಿ,0
ರಾಜಕೀಯ ನಾಯಕನ ರಾಜೀನಾಮೆ ಬಗ್ಗೆ ತಪ್ಪು ವರದಿ,0
ಆಸ್ಪತ್ರೆಯಿಂದ ದಿಢೀರ್​ ಡಿಸ್ಚಾರ್ಜ್​ ಆದ ದರ್ಶನ್​ ಗೆಳೆಯ ಆಂಟೋನಿ ಅನುಮಾನ ಮೂಡಿಸಿದ ನಡೆ,1
ಸಿನಿಮಾ ನಟನ ಹೊಸ ಚಿತ್ರ ಬಿಡುಗಡೆ ಬಗ್ಗೆ ತಪ್ಪು ಮಾಹಿತಿ,0
ರಲ್ಲಿ ರಾಜಕೀಯ ನಾಯಕನ ಹೊಸ ಯೋಜನೆ ಬಗ್ಗೆ ತಪ್ಪು ವರದಿ,0
ವೈರಲ್ ವಿಡಿಯೋದಲ್ಲಿ ತೋರಿದ ಘಟನೆ ನಿಜವಲ್ಲ,0
ಸಚಿನ್ ಅಭಿಮಾನಿಗಳಿಗೆ ಸಿಹಿ ಸುದ್ಧಿ ಸಚಿನ್​ ಜೀವನಾಧರಿತ ಚಿತ್ರಕ್ಕೆ ಮತ್ತೊಂದು ಪ್ರಶಸ್ತಿ,1
ರಲ್ಲಿ ಪ್ರಸಿದ್ಧ ಗಾಯಕನ ಹೊಸ ಆಲ್ಬಮ್ ಬಗ್ಗೆ ಸುಳ್ಳು ಸುದ್ದಿ,0
ರಲ್ಲಿ ಪ್ರಸಿದ್ಧ ಗಾಯಕನ ಹೊಸ ಆಲ್ಬಮ್ ಬಗ್ಗೆ ಸುಳ್ಳು ಸುದ್ದಿ,0
ರಲ್ಲಿ ಹೊಸ ಟೆಕ್ ಕಂಪನಿಯ ipo ಬಗ್ಗೆ ತಪ್ಪು ಮಾಹಿತಿ,0
ನಾಪತ್ತೆಯಾದ ನಾಗರತ್ನ ಹಲ್ಲೆ ಪ್ರಕರಣದಲ್ಲಿ ಸಿಗಲಿದೆಯಾ ಜಾಮೀನು,1
ಕ್ರೀಡೆಗಳಲ್ಲಿ ಬೆಟ್ಟಿಂಗ್ ಜೂಜಿಗೆ ಕಾನೂನಿನ ಮಾನ್ಯತೆ ಮುದ್ಗಲ್ ಸಮಿತಿ ಕ್ರಿಕೆಟ್ ಪಂಡಿತರಿಂದಲೂ ಅಭಿಮತ,1
ಯಶ್​ ಆಫರ್​ ನೀಡಿದರೆ ಬಾಲಿವುಡ್​ ನಟಿ ಕನ್ನಡ ಚಿತ್ರರಂಗಕ್ಕೆ ಕಾಲಿಡ್ತಾರಂತೆ,1
ಭಾರತ ಇಂಗ್ಲೆಂಡ್ ಸರಣಿ ಗೆದ್ದರೆ ಕೊಹ್ಲಿ ಪಡೆ ನಿರ್ಮಿಸಲಿದೆ ಮಗದೊಂದು ದಾಖಲೆ,1
ವಿಕ್ರಂ ಆಸ್ಪತ್ರೆಯಲ್ಲಿ ನಟಿ ಜಯಂತಿ ಅವರನ್ನು ಭೇಟಿ ಮಾಡಿದ ಮುಖ್ಯಮಂತ್ರಿ ಸಿದ್ದರಾಮಯ್ಯ,1
ಪ್ರಸಿದ್ಧ ಆಟಗಾರನ ತಂಡ ಬದಲಾವಣೆ ಬಗ್ಗೆ ಸುಳ್ಳು ಸುದ್ದಿ,0
ವಾಟ್ಸ್​​ಆ್ಯಪ್ ಅಪ್​ಡೇಟ್​ ಅಪ್ಲಿಕೇಶನ್​​ನಲ್ಲಿ ಬಂದಿದೆ ಮತ್ತೆರಡು ಆಕರ್ಷಕ ಫೀಚರ್,1
ಸಿನಿಮಾ ನಟಿಯ ಹೊಸ ಚಿತ್ರ ಬಿಡುಗಡೆ ಬಗ್ಗೆ ತಪ್ಪು ವರದಿ,0
ಪಂದ್ಯಕ್ಕೂ ಮೊದಲು ನಾಯಿ ಜೊತೆ ಆಟ ಪಂದ್ಯದಿಂದಲೇ ಹೊರಗುಳಿಯಬೇಕಾಯ್ತು ಕ್ರಿಕೆಟರ್​,1
ತಿರುವನಂತಪುರಂನಲ್ಲಿ ತಲೆ ಎತ್ತಿದೆ ಧೋನಿಯ ಅಡಿ ಎತ್ತರದ ಕಟೌಟ್​,1
ರಲ್ಲಿ ಪ್ರಸಿದ್ಧ ಗಾಯಕನ ಹೊಸ ಆಲ್ಬಮ್ ಬಗ್ಗೆ ಸುಳ್ಳು ಸುದ್ದಿ,0
ಪ್ರಸಿದ್ಧ ಆಟಗಾರನ ತಂಡ ಬದಲಾವಣೆ ಬಗ್ಗೆ ತಪ್ಪು ಸುದ್ದಿ,0
ಆಟೋ ಚಾಲಕನ​ ಹಗಲು ದರೋಡೆ ಕೇಳಿದ್ದಕ್ಕೆ ನಟಿಯ ಹಲ್ಲೆ,1
ಮರೆಯಾದ ನೈಜ ಆಟ ವಿಶ್ವಕಪ್​ಗೂ ಮುನ್ನವೇ ಅಂತ್ಯವಾಗುತ್ತಾ ಧೋನಿ ಕ್ರಿಕೆಟ್ ಕೆರಿಯರ್,1
ರಲ್ಲಿ ರಾಜಕೀಯ ನಾಯಕನ ರಾಜೀನಾಮೆ ಬಗ್ಗೆ ತಪ್ಪು ಮಾಹಿತಿ,0
ವರ್ಷಗಳ ಬಳಿಕ ಪಾಕಿಸ್ತಾನಕ್ಕೆ ಕಾಲಿಡಲಿದ್ದಾರೆ ಎಬಿ ಡಿವಿಲಿಯರ್ಸ್​​​,1
ರಲ್ಲಿ ರಾಜಕೀಯ ಪಕ್ಷದ ಗೆಲುವಿನ ಬಗ್ಗೆ ಸುಳ್ಳು ಸುದ್ದಿ,0
ಪ್ರಸಿದ್ಧ ಆಟಗಾರನ ಗಾಯದ ಬಗ್ಗೆ ಸುಳ್ಳು ಸುದ್ದಿ,0
ರಾಜಕೀಯ ಪಕ್ಷದ ಸದಸ್ಯರ ಬಂಧನದ ಬಗ್ಗೆ ಸುಳ್ಳು ಸುದ್ದಿ,0
ರಾಜಕೀಯ ಪಕ್ಷದ ಸದಸ್ಯರ ರಾಜೀನಾಮೆ ಬಗ್ಗೆ ಸುಳ್ಳು ಸುದ್ದಿ,0
ಬಹುಕೋಟಿ ಐಪಿಎಲ್ ಬೆಟ್ಟಿಂಗ್ ಪ್ರಕರಣದಲ್ಲಿ ಸಲ್ಲೂ ಸಹೋದರನಿಗೆ ಸಂಕಷ್ಟ,1
ರಲ್ಲಿ ವೈದ್ಯಕೀಯ ಸಂಶೋಧನೆಯ ಅಪಾಯಗಳ ಬಗ್ಗೆ ಸುಳ್ಳು ಸುದ್ದಿ,0
ರಲ್ಲಿ ಆರ್ಥಿಕ ಮಾರುಕಟ್ಟೆಯಲ್ಲಿ ಏರಿಕೆ ಬಗ್ಗೆ ತಪ್ಪು ಮಾಹಿತಿ,0
ಕನ್ನಡ ಚಿತ್ರರಂಗದಲ್ಲಿ ಹೊಸ ನಿರ್ದೇಶಕ,1
ರಲ್ಲಿ ರಾಜಕೀಯ ನಾಯಕನ ಹೊಸ ಯೋಜನೆ ಬಗ್ಗೆ ತಪ್ಪು ವರದಿ,0
ಇನ್ಮುಂದೆ ಕತ್ತಲಲ್ಲೂ ಫೇಸ್​ಬುಕ್​ ಚಾಟಿಂಗ್ ಮತ್ತಷ್ಟು ಆಸಕ್ತಿದಾಯಕ ಆ್ಯಪ್​​ನಲ್ಲಿ ಆಯ್ಕೆ ಇದೆಯೇ,1
ರಲ್ಲಿ ರಾಜಕೀಯ ನಾಯಕನ ಹೊಸ ಯೋಜನೆ ಬಗ್ಗೆ ತಪ್ಪು ವರದಿ,0
ಐಪಿಎಲ್​ನಲ್ಲಿ ಕೋಲ್ಕತ್ತಾ ಚೆನ್ನೈ ಹಣಾಹಣಿ ಗೆಲುವಿನ ನಾಗಾಲೋಟದಲ್ಲಿರುವ ಧೋನಿ ಪಡೆಗೆ ದಿನೇಶ್ ಕಾರ್ತಿಕ್ ಸವಾಲು,1
ರಲ್ಲಿ ಆರೋಗ್ಯ ಉತ್ಪನ್ನದ ಅಪಾಯಗಳ ಬಗ್ಗೆ ತಪ್ಪು ವರದಿ,0
ಕೇಪ್​ಟೌನ್ ಭಾರತಕ್ಕೆ ಗೆಲ್ಲಲು ರನ್ ಟಾರ್ಗೆಟ್,1
photos ಭೂ ಲೋಕದ ಸ್ವರ್ಗದಂತೆ ಇರುವ ಇಟಲಿಯ ಸ್ಥಳದಲ್ಲಿ ದೀಪಿಕಾ ರಣವೀರ್​ ಮದುವೆ ನಡೆಯಲಿದೆ,1
ರಲ್ಲಿ ಪ್ರಸಿದ್ಧ ಗಾಯಕನ ಮರಣದ ಬಗ್ಗೆ ಸುಳ್ಳು ಸುದ್ದಿ,0
ರಲ್ಲಿ ರಾಜಕೀಯ ನಾಯಕನ ಬಂಧನದ ಬಗ್ಗೆ ಸುಳ್ಳು ಸುದ್ದಿ,0
ಶ್ರದ್ಧಾಂಜಲಿ ಸಭೆಯಲ್ಲಿ ಅಳುತ್ತಿದ್ದ ಸುಮಲತಾರನ್ನು ನಗಿಸಲು ಅಭಿಷೇಕ್​ ಮಾಡಿದ್ದೇನು ಗೊತ್ತಾ,1
ಸಿನಿಮಾ ನಟಿಯ ಹೊಸ ಚಿತ್ರದಲ್ಲಿ ಅಭಿನಯದ ಬಗ್ಗೆ ಸುಳ್ಳು ಮಾಹಿತಿ,0
ಜಿಯೋ ಡಬಲ್ ಧಮಾಕಾ ಪ್ರತಿದಿನ ಸಿಗುತ್ತೆ ಹೆಚ್ಚುವರಿ gb ಡೇಟಾ,1
ಅತ್ತೆ ಪಾರ್ವತಮ್ಮನವರ ಹಾದಿಯಲ್ಲೇ ಸಾಗುತ್ತಿರುವ ಪುನೀತ್​ ಪತ್ನಿ ಅಶ್ವಿನಿ,1
ಎಫ್​ಐಆರ್​ ರದ್ದು ಕೋರಿ ಶ್ರುತಿ ಸರ್ಜಾ ಸಲ್ಲಿಸಿದ್ದ ಅರ್ಜಿ ವಿಚಾರಣೆ ಮುಂದೂಡಿದ ಕೋರ್ಟ್​​,1
video ವಿರಾಟ್ ಕೊಹ್ಲಿ ವಿಕೆಟ್ ಪಡೆದು ವಿಶ್ವದ ಗಮನ ಸೆಳೆದ ಯುವ ವೇಗಿ,1
ಆರೋಪ ಮುಕ್ತವಾಗುವವರೆಗೂ ಮಲಯಾಳಂನ ದಿಲೀಪ್​ ಮೇಲಿನ ನಿಷೇಧ ಮುಂದುವರಿಕೆ ಮೋಹನ್​ಲಾಲ್​,1
ಮನೆಯಲ್ಲಿ ಸಿಂಹವನ್ನು ಸಾಕಿದ್ದಾರಾ ಶಾಹಿದ್ ಅಫ್ರಿದಿ ಫೋಟೋ ಬಿಚ್ಚಿಟ್ಟ ಶಾಕಿಂಗ್ ಸತ್ಯ,1
ಮಣಿಕರ್ಣಿಕಾ ಸಿನಿಮಾದಲ್ಲಿ ಆಟದ ಕುದುರೆ ಏರಿ ಯುದ್ಧ ಮಾಡಿದ ಕಂಗನಾ,1
ರಲ್ಲಿ ಕ್ರಿಕೆಟ್ ತಂಡದ ನಾಯಕನ ರಾಜೀನಾಮೆ ಬಗ್ಗೆ ಸುಳ್ಳು ಸುದ್ದಿ,0
ಕಾನ್ಸ್​ನಲ್ಲಿ ಬಿಡುಗಡೆಯಾಯಿತು ಲಿಹಾಫ್​ ಸಿನಿಮಾದ ಮೊದಲ ಪೋಸ್ಟರ್​,1
ಸಾಮಾಜಿಕ ಜಾಲತಾಣದಲ್ಲಿ ಹರಡಿದ ಸುಳ್ಳು ವಿಡಿಯೋ ಕ್ಲಿಪ್,0
ಕುತೂಹಲ ಹುಟ್ಟಿಸಿದೆ ಮಂಜನ ಸಿನಿಮಾ ಸಸ್ಪೆನ್ಸ್ ಥ್ರಿಲ್ಲರ್​ನಲ್ಲಿದೆ ಕಾಮಿಡಿ ಹಂಗಾಮ,1
ರಲ್ಲಿ ಆರ್ಥಿಕ ಮಾರುಕಟ್ಟೆಯಲ್ಲಿ ಬಂಡವಾಳ ಹೂಡಿಕೆ ಬಗ್ಗೆ ತಪ್ಪು ವರದಿ,0
ಹೈದರಾಬಾದ್ ಅಂಗಳದಲ್ಲಿ ಇಂದಿನಿಂದ ಭಾರತ ವೆಸ್ಟ್​​ ಇಂಡೀಸ್ ನಡುವೆ ನೇ ಟೆಸ್ಟ್,1
ರಲ್ಲಿ ವೈದ್ಯಕೀಯ ಸಂಶೋಧನೆಯ ಯಶಸ್ಸಿನ ಬಗ್ಗೆ ತಪ್ಪು ಮಾಹಿತಿ,0
ರಾಜಮೌಳಿ ನಿರ್ದೇಶಿಸುವ ಹೊಸ ಚಿತ್ರದ ಕಥೆ ಇದಂತೆ,1
ಮಹಿಳಾ ವಿಶ್ವಕಪ್ ಹಾಕಿ ಗೆಲ್ಲಲೇ ಬೇಕಾದ ಒತ್ತಡದಲ್ಲಿ ಭಾರತೀಯ ವನಿತೆಯರು,1
ಹೊಸ ಶಿಕ್ಷಣ ನೀತಿಯ ಅನುಷ್ಠಾನ ಬಗ್ಗೆ ತಪ್ಪು ಮಾಹಿತಿ,0
ವಿಶ್ವ ನಂ ಆಟಗಾರ ಜ್ಯಾಕ್ ಸಾಕ್ ವಿರುದ್ಧ ಭಾರತದ ಯುಕಿ ಭಾಂಬ್ರಿಗೆ ವೀರೋಚಿತ ಸೋಲು,1
ಬಿಗ್ ಬಜೆಟ್​ ಸಿನಿಮಾಗಳೇ ಐಟಿ ದಾಳಿಗೆ ಕಾರಣ ಇರಬಹುದು ಸುದೀಪ್​,1
ರಲ್ಲಿ ಆರ್ಥಿಕ ಹೂಡಿಕೆ ಬಗ್ಗೆ ತಪ್ಪು ಮಾಹಿತಿ,0
ಟೀಂ ಇಂಡಿಯಾದ ಮಾಜಿ ಆಟಗಾರನ ಮಾರಣಾಂತಿಕ ಹಲ್ಲೆ,1
ರಲ್ಲಿ ರಾಜಕೀಯ ನಾಯಕನ ರಾಜೀನಾಮೆ ಬಗ್ಗೆ ತಪ್ಪು ವರದಿ,0
ಆರ್ಥಿಕ ಮಾರುಕಟ್ಟೆಯಲ್ಲಿ ಕುಸಿತ ಸುಳ್ಳು ಸುದ್ದಿ,0
ನೇ ಆಸ್ಕರ್ ಪ್ರಶಸ್ತಿ ವಿಜೇತರ ಚಿತ್ರಪಟಗಳು,1
ಪಾಕಿಸ್ತಾನ ವಿರುದ್ಧ ರನ್​ಗಳ ಭರ್ಜರಿ ಜಯ ಗಳಿಸಿ ಫೈನಲ್ ಪ್ರವೇಶಿಸಿದ ಭಾರತದ ಅಂಡರ್ ತಂಡ,1
ಸಾಮಾಜಿಕ ತಾಣಗಳಲ್ಲಿ ಸೋರಿಕೆ ಆಗಿದೆ ‘ರೆಡ್​ ಮಿ ನೋಟ್​ ಬಿಡುಗಡೆ​ ದಿನಾಂಕ,1
ಬಿಗ್​ಬಾಸ್​ ಚಂದನ್​ಗೆ ಅಮ್ಮನಿಂದ ಸಿಕ್ಕ ಅನಿರೀಕ್ಷಿತ ಉಡುಗೊರೆ ಗೊತ್ತಾ,1
ದಿನೇ ದಿನೇ ಹೆಚ್ಚಿಸುತ್ತಿದೆ ‘ಕೆ ಜಿ ಎಫ್’ ಸಿನಿಮಾಗೆ ಹಾಲಿವುಡ್ ಸಂಸ್ಥೆಗಳಿಂದ ಸೌಂಡ್ ಎಫೆಕ್ಟ್,1
ರಲ್ಲಿ ರಾಜಕೀಯ ನಾಯಕನ ರಾಜೀನಾಮೆ ಬಗ್ಗೆ ತಪ್ಪು ಮಾಹಿತಿ,0
ರಲ್ಲಿ ರಾಜಕೀಯ ಪಕ್ಷದ ಸದಸ್ಯರ ರಾಜೀನಾಮೆ ಬಗ್ಗೆ ತಪ್ಪು ವರದಿ,0
ರಾಜಕೀಯ ನಾಯಕನ ಹೊಸ ಯೋಜನೆ ಯಶಸ್ವಿಯಾಗಿದೆ ಸುಳ್ಳು ಸುದ್ದಿ,0
ಭಟ್ಟರ ಶಿಷ್ಯನ ಸಿನಿಮಾಗೆ ಸಮಸ್ಯೆಯಾದ ಶೀರ್ಷಿಕೆ ಅಯೋಗ್ಯ ಗ್ರಾಮ ಪಂಚಾಯ್ತಿ ಸದಸ್ಯ,1
video ಇತಿಹಾಸದ ಪುಟ ಸೇರಿದ ಮೈಸೂರಿನ ಪ್ರೀಮಿಯರ್​ ಸ್ಟುಡಿಯೊ,1
‘ಪಿಂಕ್’ ತಮಿಳು ರಿಮೇಕ್​ನಲ್ಲಿ ಕನ್ನಡತಿ ಶ್ರದ್ಧಾ ಶ್ರೀನಾಥ್ ಕೊಟ್ಟರು ಹೊಸ ಸುದ್ದಿ,1
ಹಿಮಾ ದಾಸ್ ಓಟದ ತಾರೆ ಏರೋಪ್ಲೇನ್ ಕನಸು ಹಾಗೂ ಉಜ್ವಲ ಭವಿಷ್ಯ,1
ರಲ್ಲಿ ವೈದ್ಯಕೀಯ ಉತ್ಪನ್ನದ ಲಾಭದ ಬಗ್ಗೆ ತಪ್ಪು ವರದಿ,0
ರಾಜಕೀಯ ನಾಯಕನ ರಾಜೀನಾಮೆ ಬಗ್ಗೆ ತಪ್ಪು ವರದಿ,0
ipl ಆರ್​ಸಿಬಿ ತಂಡಕ್ಕೆ ಹೊಸ ಆಟಗಾರರ ಸೇರ್ಪಡೆ,1
ರಲ್ಲಿ ಆರ್ಥಿಕ ಮಾರುಕಟ್ಟೆಯಲ್ಲಿ ಕುಸಿತದ ಬಗ್ಗೆ ತಪ್ಪು ವರದಿ,0
live ಐಪಿಎಲ್ ಚೆನ್ನೈ ಸೂಪರ್ ಕಿಂಗ್ಸ್​​ vs ಡೆಲ್ಲಿ ಡೇರ್ ಡೆವಿಲ್ಸ್​ ಪಂತ್ ಶಂಕರ್ ಹೋರಾಟ ವ್ಯರ್ಥ ಚೆನ್ನೈ​​ಗೆ ರನ್​ಗಳ ರೋಚಕ ಜಯ​,1
ಹಾಲಿವುಡ್​ ಸ್ಟಾರ್​ಗಳನ್ನೇ ಹಿಂದಿಕ್ಕಿ ಮೋಸ್ಟ್​ ಹ್ಯಾಂಡ್​ಸಮ್​ ಹೀರೋ ಪಟ್ಟ ಗಿಟ್ಟಿಸಿಕೊಂಡ ಹೃತಿಕ್​ ರೋಷನ್​,1
ಸಾವಿನ ನಂತರವಾದರೂ ಒಂದಾಗುತ್ತಾರಾ ಅಂಬಿ ವಿಷ್ಣು ವರ್ಷವಾದರೂ ಆರಂಭವಾಗಲಿಲ್ಲ ವಿಷ್ಣು ಸ್ಮಾರಕ ಕೆಲಸ,1
ರಲ್ಲಿ ವೈದ್ಯಕೀಯ ಸಂಶೋಧನೆಯ ಯಶಸ್ಸಿನ ಬಗ್ಗೆ ಸುಳ್ಳು ಮಾಹಿತಿ,0
ಬಾಲಿವುಡ್ ನಟನ ಹೊಸ ಚಿತ್ರ ಬಿಡುಗಡೆಯಾಯಿತು,1
ಸಿನಿಮಾ ನಟಿಯ ವಿವಾಹದ ಬಗ್ಗೆ ಸುಳ್ಳು ಸುದ್ದಿ,0
ಹೊಸ ಶಿಕ್ಷಣ ನೀತಿಯ ಬಗ್ಗೆ ತಪ್ಪು ಮಾಹಿತಿ,0
ರಾಜಕೀಯ ನಾಯಕನ ಬಗ್ಗೆ ಸುಳ್ಳು ಸುದ್ದಿ ಹರಡಿದ ಮಾಧ್ಯಮಗಳು,0
ರಲ್ಲಿ ವೈದ್ಯಕೀಯ ಸಂಶೋಧನೆಯ ಅಪಾಯಗಳ ಬಗ್ಗೆ ಸುಳ್ಳು ಮಾಹಿತಿ,0
ರಕ್ಷಾ ಬಂಧನದಂದು ಗಿಫ್ಟ್​ಗಳನ್ನು ಸೋದರಿಯರಿಗೆ ನೀಡಿ,1
ರೆಬೆಲ್ ಪುತ್ರನ ಸಿನಿ ಎಂಟ್ರಿಗೆ ನೂರೆಂಟು ವಿಘ್ನಗಳು ಅಂಬಿ ಮಗ ಅಭಿ ಸಿನಿಮಾ ಸೆಟ್ಟೇರೋದು ಯಾವಾಗ,1
ರಲ್ಲಿ ರಾಜಕೀಯ ನಾಯಕನ ರಾಜೀನಾಮೆ ಬಗ್ಗೆ ತಪ್ಪು ವರದಿ,0
ಸ್ಟಾರ್​ಗಳ ನೆಚ್ಚಿನ ಮಾಸ್ಟರ್​ ಮಸಲ್ ಇವರ ತರಬೇತಿ ಪಡೆದರೆ ಸಿಕ್ಸ್ ಪ್ಯಾಕ್ ಗ್ಯಾರಂಟಿ,1
ರಾಜ್ಯದಲ್ಲಿ ವಾರ ತೆರೆ ಕಾಣಲಿರುವ ಸಿನಿಮಾಗಳು,1
ರಲ್ಲಿ ಆರ್ಥಿಕ ಮಾರುಕಟ್ಟೆಯಲ್ಲಿ ಬಂಡವಾಳ ಹೂಡಿಕೆ ಬಗ್ಗೆ ತಪ್ಪು ವರದಿ,0
ಬಾಲಿವುಡ್ ನಟಿ ಶ್ರೀದೇವಿ ಚಿತ್ರೀಕರಣದ ಚಿತ್ರಪಟಗಳು,1
ರಲ್ಲಿ ರಾಜಕೀಯ ನಾಯಕನ ರಾಜೀನಾಮೆ ಬಗ್ಗೆ ತಪ್ಪು ವರದಿ,0
ದೀಪಿಕಾ ರಿಜೆಕ್ಟ್​ ಮಾಡಿದ್ದ ಹೀರೋ ಬಾಲಿವುಡ್​ನಲ್ಲಿ ಹಾಟ್​ ಫೇವರಿಟ್​,1
photos ಬಾಲಿವುಡ್​ನ ಸ್ಟನ್ನಿಂಗ್​ ಬ್ಯೂಟಿ ಆ್ಯಮಿ ಜಾಕ್ಸನ್​ರ ಕೆಲವು ಹಾಟ್​ ಫೋಟೋಗಳು,1
ರಲ್ಲಿ ವೈದ್ಯಕೀಯ ಸಂಶೋಧನೆಯ ಯಶಸ್ಸಿನ ಬಗ್ಗೆ ತಪ್ಪು ವರದಿ,0
ಫೇಸ್​​​ಬುಕ್ ಆರೋಗ್ಯಕ್ಕೂ ಹಾನಿಕಾರಕ ಸಂಶೋಧನೆಯಿಂದ ತಿಳಿದುಬಂತು ಅಚ್ಚರಿ ಮಾಹಿತಿ,1
